{
    "$schema": "http://json-schema.org/draft-07/schema#",
    "$id": "file:///usr/share/saptune/schemas/1.0/saptune_solution_simulate.schema.json",
    "title": "",
    "description": "Describes the output of 'saptune solution simulate.",
    "type": "object",
    "required": [
        "$schema",
        "publish time",
        "argv",
        "pid",
        "command",
        "exit code",
        "result",
        "messages"
    ],
    "additionalProperties": true,
    "propertyNames": {
        "enum": [
            "$schema",
            "publish time",
            "argv",
            "pid",
            "command",
            "exit code",
            "result",
            "messages",
            "Angela's pieces of wisdom"
        ]
    },
    "properties": {
        "$schema": {
            "description": "URI to the schema definition",
            "type": "string"
        },
        "publish time": {
            "description": "saptune timestamp of the time this JSON object was created.",
            "type": "string",
            "pattern": "^((?:(\\d{4}-\\d{2}-\\d{2}) (\\d{2}:\\d{2}:\\d{2}(?:\\.\\d{3})?)))$",
            "examples": [
                "2022-02-16 10:51:41.163",
                "2022-01-28 17:26:19.661"
            ]
        },
        "argv": {
            "description": "The entire saptune command as it was called.",
            "type": "string",
            "minLength": 7,
            "examples": [
                "saptune --format=json note list",
                "saptune --format=json version",
                "saptune --format=json json status"
            ]
        },
        "pid": {
            "description": "PID of the saptune process creating this object.",
            "type": "integer",
            "minimum": 2
        },
        "command": {
            "description": "The saptune command (classifier), which was executed.",
            "type": "string",
            "enum": [
                "solution simulate"
            ]
        },
        "result": {
            "description": "The result (output) of the command.",
            "type": "object",
            "required": [
                "simulations",
                "attentions"
            ],
            "additionalProperties": false,
            "properties": {
                "simulations": {
                    "description": "List of simulations (lines of the table output of `saptune solution simulate`.",
                    "type": "array",
                    "items": {
                        "type": "object",
                        "required": [
                            "parameter"
                        ],
                        "additionalProperties": true,
                        "propertyNames": {
                            "enum": [
                                "Note ID",
                                "Note version",
                                "parameter",
                                "expected value",
                                "override value",
                                "actual value",
                                "comment",
                                "amendments"
                            ]
                        },
                        "properties": {
                            "parameter": {
                                "description": "Name of the parameter.",
                                "type": "string",
                                "pattern": "^[^ ]+$",
                                "examples": [
                                    "LIMIT_@dba_hard_nofile",
                                    "kernel.shmall"
                                ]
                            },
                            "expected value": {
                                "description": "Value of a parameter.",
                                "type": "string",
                                "examples": [
                                    "18446744073709551615",
                                    "-nobarrier",
                                    "never"
                                ]
                            },
                            "override value": {
                                "description": "Value of a parameter.",
                                "type": "string",
                                "examples": [
                                    "18446744073709551615",
                                    "-nobarrier",
                                    "never"
                                ]
                            },
                            "actual value": {
                                "description": "Value of a parameter.",
                                "type": "string",
                                "examples": [
                                    "18446744073709551615",
                                    "-nobarrier",
                                    "never"
                                ]
                            },
                            "comment": {
                                "type": "string"
                            },
                            "amendments": {
                                "description": "Optional amendments (footnotes).",
                                "type": "array",
                                "items": {
                                    "description": "Amendment (footnote) consists of an id and the explaining text.",
                                    "type": "object",
                                    "required": [
                                        "index",
                                        "amendment"
                                    ],
                                    "additionalProperties": false,
                                    "properties": {
                                        "index": {
                                            "description": "Index of the amendment (footnote).",
                                            "type": "integer",
                                            "examples": [
                                                "11",
                                                "15"
                                            ]
                                        },
                                        "amendment": {
                                            "description": "Describes the meaning of the amendment (footnote).",
                                            "type": "string",
                                            "minLength": 1,
                                            "examples": [
                                                "the parameter is only used to calculate the size of tmpfs (/dev/shm)",
                                                "setting is not available on the system"
                                            ]
                                        }
                                    }
                                }
                            }
                        }
                    }
                },
                "attentions": {
                    "description": "Attentions printed for a Note.",
                    "type": "array",
                    "items": {
                        "required": [
                            "Note ID",
                            "attention"
                        ],
                        "additionalProperties": false,
                        "properties": {
                            "Note ID": {
                                "description": "The Note ID.",
                                "type": "string",
                                "pattern": "^[^ ]+$",
                                "examples": [
                                    "1656250",
                                    "SAP_BOBJ"
                                ]
                            },
                            "attention": {
                                "type": "string",
                                "minLength": 1
                            }
                        }
                    }
                }
            }
        },
        "exit code": {
            "description": "The return code the saptune command terminated with.",
            "type": "integer",
            "minimum": 0,
            "maximum": 255
        },
        "messages": {
            "description": "Contains all log messages normally printed on the screen in the order they were created.",
            "type": "array",
            "items": {
                "description": "A single message.",
                "type": "object",
                "required": [
                    "priority",
                    "message"
                ],
                "additionalProperties": false,
                "properties": {
                    "priority": {
                        "description": "Priority of the log messages as defined at https://confluence.suse.com/display/SAP/Logging+Guide.",
                        "type": "string",
                        "enum": [
                            "CRITICAL",
                            "ERROR",
                            "WARNING",
                            "NOTICE",
                            "INFO",
                            "DEBUG"
                        ]
                    },
                    "message": {
                        "description": "The log message itself.",
                        "type": "string",
                        "minLength": 1,
                        "examples": [
                            "main.go:57: saptune (3.0.2) started with 'saptune status'",
                            "system.go:235: saptune terminated with exit code '1'"
                        ]
                    }
                }
            }
        }
    }
}