{
    "$schema": "file:///usr/share/saptune/schemas/1.0/saptune_solution_simulate.schema.json",
    "publish time": "2022-10-04 10:10:38.654",
    "argv": "saptune --format=json solution simulate HANA",
    "pid": 1902,
    "command": "solution simulate",
    "exit code": 0,
    "result": {
      "simulations": [
        {
          "parameter": "LIMIT_@dba_hard_nofile",
          "expected value": "@dba hard nofile 1048576",
          "actual value": "@dba hard nofile 1048576"
        },
        {
          "parameter": "LIMIT_@dba_soft_nofile",
          "expected value": "@dba soft nofile 1048576",
          "actual value": "@dba soft nofile 1048576"
        },
        {
          "parameter": "LIMIT_@sapsys_hard_nofile",
          "expected value": "@sapsys hard nofile 1048576",
          "actual value": "@sapsys hard nofile 1048576"
        },
        {
          "parameter": "LIMIT_@sapsys_soft_nofile",
          "expected value": "@sapsys soft nofile 1048576",
          "actual value": "@sapsys soft nofile 1048576"
        },
        {
          "parameter": "LIMIT_@sdba_hard_nofile",
          "expected value": "@sdba hard nofile 1048576",
          "actual value": "@sdba hard nofile 1048576"
        },
        {
          "parameter": "LIMIT_@sdba_soft_nofile",
          "expected value": "@sdba soft nofile 1048576",
          "actual value": "@sdba soft nofile 1048576"
        },
        {
          "parameter": "vm.max_map_count",
          "expected value": "2147483647",
          "actual value": "2147483647"
        },
        {
          "parameter": "net.core.rmem_max",
          "actual value": "212992",
          "comment": " [7]",
          "amendments": [
            {
              "index": 7,
              "amendment": " [7] parameter value is untouched by default"
            }
          ]
        },
        {
          "parameter": "net.core.somaxconn",
          "expected value": "4096",
          "actual value": "4096"
        },
        {
          "parameter": "net.core.wmem_max",
          "actual value": "212992",
          "comment": " [7]",
          "amendments": [
            {
              "index": 7,
              "amendment": " [7] parameter value is untouched by default"
            }
          ]
        },
        {
          "parameter": "net.ipv4.ip_local_port_range",
          "actual value": "32768 60999",
          "comment": " [7]",
          "amendments": [
            {
              "index": 7,
              "amendment": " [7] parameter value is untouched by default"
            }
          ]
        },
        {
          "parameter": "net.ipv4.ip_local_reserved_ports",
          "actual value": "",
          "comment": " [7]",
          "amendments": [
            {
              "index": 7,
              "amendment": " [7] parameter value is untouched by default"
            }
          ]
        },
        {
          "parameter": "net.ipv4.tcp_max_syn_backlog",
          "expected value": "8192",
          "actual value": "8192"
        },
        {
          "parameter": "net.ipv4.tcp_rmem",
          "actual value": "4096 131072 6291456",
          "comment": " [7]",
          "amendments": [
            {
              "index": 7,
              "amendment": " [7] parameter value is untouched by default"
            }
          ]
        },
        {
          "parameter": "net.ipv4.tcp_slow_start_after_idle",
          "expected value": "0",
          "actual value": "0"
        },
        {
          "parameter": "net.ipv4.tcp_syn_retries",
          "expected value": "8",
          "actual value": "8"
        },
        {
          "parameter": "net.ipv4.tcp_timestamps",
          "expected value": "1",
          "actual value": "1"
        },
        {
          "parameter": "net.ipv4.tcp_tw_reuse",
          "actual value": "2",
          "comment": " [7]",
          "amendments": [
            {
              "index": 7,
              "amendment": " [7] parameter value is untouched by default"
            }
          ]
        },
        {
          "parameter": "net.ipv4.tcp_window_scaling",
          "expected value": "1",
          "actual value": "1"
        },
        {
          "parameter": "net.ipv4.tcp_wmem",
          "actual value": "4096 16384 4194304",
          "comment": " [7]",
          "amendments": [
            {
              "index": 7,
              "amendment": " [7] parameter value is untouched by default"
            }
          ]
        },
        {
          "parameter": "kernel.shmmni",
          "expected value": "32768",
          "actual value": "32768"
        },
        {
          "parameter": "IO_SCHEDULER_sda",
          "expected value": "none",
          "actual value": "none"
        },
        {
          "parameter": "IO_SCHEDULER_sdb",
          "expected value": "none",
          "actual value": "none"
        },
        {
          "parameter": "IO_SCHEDULER_sdc",
          "expected value": "none",
          "actual value": "none"
        },
        {
          "parameter": "IO_SCHEDULER_sdd",
          "expected value": "none",
          "actual value": "none"
        },
        {
          "parameter": "rpm:psmisc",
          "expected value": "23.0-6.16.1",
          "actual value": "",
          "comment": " [3]",
          "amendments": [
            {
              "index": 3,
              "amendment": " [3] value is only checked, but NOT set"
            }
          ]
        },
        {
          "parameter": "rpm:uuidd",
          "expected value": "2.36.2-150300.4.17.1",
          "actual value": "2.36.2-150300.4.23.1",
          "comment": " [3]",
          "amendments": [
            {
              "index": 3,
              "amendment": " [3] value is only checked, but NOT set"
            }
          ]
        },
        {
          "parameter": "systemd:sysstat.service",
          "expected value": "start",
          "actual value": "start, disable"
        },
        {
          "parameter": "systemd:uuidd.socket",
          "expected value": "start",
          "actual value": "start, enable"
        },
        {
          "parameter": "vm.dirty_background_bytes",
          "expected value": "314572800",
          "actual value": "314572800"
        },
        {
          "parameter": "vm.dirty_bytes",
          "expected value": "629145600",
          "actual value": "629145600"
        },
        {
          "parameter": "xfsopt_barrier",
          "expected value": "-barrier",
          "comment": " [2]",
          "amendments": [
            {
              "index": 2,
              "amendment": " [2] setting is not available on the system"
            }
          ]
        },
        {
          "parameter": "xfsopt_nobarrier",
          "expected value": "-nobarrier",
          "comment": " [2]",
          "amendments": [
            {
              "index": 2,
              "amendment": " [2] setting is not available on the system"
            }
          ]
        },
        {
          "parameter": "KSM",
          "expected value": "0",
          "actual value": "0"
        },
        {
          "parameter": "THP",
          "expected value": "never",
          "actual value": "never"
        },
        {
          "parameter": "energy_perf_bias",
          "expected value": "all:0",
          "comment": " [1]",
          "amendments": [
            {
              "index": 1,
              "amendment": " [1] setting is not supported by the system"
            }
          ]
        },
        {
          "parameter": "force_latency",
          "expected value": "70",
          "comment": " [1]",
          "amendments": [
            {
              "index": 1,
              "amendment": " [1] setting is not supported by the system"
            }
          ]
        },
        {
          "parameter": "governor",
          "expected value": "all:performance",
          "comment": " [1]",
          "amendments": [
            {
              "index": 1,
              "amendment": " [1] setting is not supported by the system"
            }
          ]
        },
        {
          "parameter": "grub:intel_idle.max_cstate",
          "expected value": "1",
          "comment": " [2] [3] [6]",
          "amendments": [
            {
              "index": 2,
              "amendment": " [2] setting is not available on the system"
            },
            {
              "index": 3,
              "amendment": " [3] value is only checked, but NOT set"
            },
            {
              "index": 6,
              "amendment": " [6] grub settings are mostly covered by other settings. See man page saptune-note(5) for details"
            }
          ]
        },
        {
          "parameter": "grub:numa_balancing",
          "expected value": "disable",
          "comment": " [2] [3] [6]",
          "amendments": [
            {
              "index": 2,
              "amendment": " [2] setting is not available on the system"
            },
            {
              "index": 3,
              "amendment": " [3] value is only checked, but NOT set"
            },
            {
              "index": 6,
              "amendment": " [6] grub settings are mostly covered by other settings. See man page saptune-note(5) for details"
            }
          ]
        },
        {
          "parameter": "grub:processor.max_cstate",
          "expected value": "1",
          "comment": " [2] [3] [6]",
          "amendments": [
            {
              "index": 2,
              "amendment": " [2] setting is not available on the system"
            },
            {
              "index": 3,
              "amendment": " [3] value is only checked, but NOT set"
            },
            {
              "index": 6,
              "amendment": " [6] grub settings are mostly covered by other settings. See man page saptune-note(5) for details"
            }
          ]
        },